{
  "$schema": "https://json-schema.org/draft/2020-12/schema",
  "$comment": "Generated from scripts/qa_contracts.py; do not edit manually.",
  "x-rule-version": "2.16.0",
  "title": "Logic Version Model",
  "type": "object",
  "additionalProperties": false,
  "required": [
    "logic_id",
    "name",
    "domain",
    "version",
    "status",
    "effective_from",
    "effective_to",
    "conditions",
    "data_sources",
    "join_rules",
    "filters",
    "calculation",
    "result",
    "exceptions",
    "supersedes",
    "changed_by_requirement",
    "evidence_sources"
  ],
  "properties": {
    "logic_id": {
      "type": "string",
      "minLength": 1
    },
    "name": {
      "type": "string",
      "minLength": 1
    },
    "domain": {
      "type": "string",
      "minLength": 1
    },
    "version": {
      "type": "string",
      "minLength": 1
    },
    "status": {
      "enum": [
        "active_confirmed",
        "candidate",
        "conflicting",
        "superseded",
        "deprecated",
        "missing"
      ]
    },
    "effective_from": {
      "type": [
        "string",
        "null"
      ]
    },
    "effective_to": {
      "type": [
        "string",
        "null"
      ]
    },
    "conditions": {
      "type": "array",
      "items": {
        "type": "string",
        "minLength": 1
      },
      "minItems": 0,
      "uniqueItems": true
    },
    "data_sources": {
      "type": "array",
      "items": {
        "type": "string",
        "minLength": 1
      },
      "minItems": 0,
      "uniqueItems": true
    },
    "join_rules": {
      "type": "array",
      "items": {
        "type": "string",
        "minLength": 1
      },
      "minItems": 0,
      "uniqueItems": true
    },
    "filters": {
      "type": "array",
      "items": {
        "type": "string",
        "minLength": 1
      },
      "minItems": 0,
      "uniqueItems": true
    },
    "calculation": {
      "type": "string",
      "minLength": 1
    },
    "result": {
      "type": "string",
      "minLength": 1
    },
    "exceptions": {
      "type": "array",
      "items": {
        "type": "string",
        "minLength": 1
      },
      "minItems": 0,
      "uniqueItems": true
    },
    "supersedes": {
      "type": [
        "string",
        "null"
      ]
    },
    "changed_by_requirement": {
      "type": [
        "string",
        "null"
      ]
    },
    "evidence_sources": {
      "type": "array",
      "items": {
        "type": "string",
        "minLength": 1
      },
      "minItems": 1,
      "uniqueItems": true
    }
  }
}
